{
  "id": "progression.marksman",
  "kind": "class_progression",
  "classId": "class.marksman",
  "levelCurveId": "test.curve.standard",
  "startingAttributes": {
    "test.attribute.might": 5,
    "test.attribute.vitality": 5,
    "test.attribute.focus": 4
  },
  "attributeGrowth": {
    "test.attribute.might": 1,
    "test.attribute.vitality": 0,
    "test.attribute.focus": 0
  },
  "startingResources": {
    "test.resource.health": 90
  },
  "resourceGrowth": {
    "test.resource.health": 4
  },
  "startingDerived": {
    "test.stat.attack": 3
  },
  "allowedAttributeIds": [
    "test.attribute.might",
    "test.attribute.vitality",
    "test.attribute.focus"
  ],
  "attributePointRules": { "pointsAtCreate": 0 },
  "skillPointRules": { "pointsAtCreate": 0 }
}
